{
  "version": 1,
  "id": "forces-and-motion",
  "topic": "forces_motion",
  "title": "Forces and motion — finding the net force",
  "summary": "Read force arrows, combine forces with direction, and connect net force to acceleration.",
  "estimated_minutes": 16,
  "sections": [
    {
      "id": "force-arrows",
      "title": "1. Arrows show size and direction",
      "markdown": "A force has both **size** and **direction**. Forces pointing the same way add; forces pointing in opposite directions subtract. If 8 N pushes right and 5 N pushes left, the net force is 3 N to the right.",
      "visualization": {
        "version": 2,
        "library": "d3",
        "renderer": "svg",
        "kind": "scene2d",
        "family": "mechanics",
        "title": "Forces acting on a cart",
        "aria_label": "A cart has an eight-newton arrow to the right and a five-newton arrow to the left, producing a three-newton net force to the right.",
        "text_fallback": "8 N right minus 5 N left gives a net force of 3 N right.",
        "height": 340,
        "controls": [{"id": "right_force", "label": "Emphasize the rightward force", "type": "range", "value": 1, "min": 0.75, "max": 1.5, "step": 0.25, "binding": {"target_label": "8 N right", "effect": "scale"}}],
        "budget": {"max_points": 256, "max_triangles": 32000, "max_fps": 30},
        "scene": {"coordinate_system": "screen", "layers": [
          {"type": "node", "id": "left", "x": 120, "y": 170, "width": 120, "height": 60, "label": "5 N left", "color": "orange"},
          {"type": "node", "id": "cart", "x": 350, "y": 170, "width": 130, "height": 76, "label": "cart", "color": "teal"},
          {"type": "node", "id": "right", "x": 600, "y": 170, "width": 120, "height": 60, "label": "8 N right", "color": "green"},
          {"type": "link", "from": "cart", "to": "left", "arrow": true, "label": "opposes"},
          {"type": "link", "from": "cart", "to": "right", "arrow": true, "label": "net: 3 N right"}
        ]}
      }
    },
    {
      "id": "newtons-second-law",
      "title": "2. Net force changes motion",
      "markdown": "Newton's second law is $F_{net}=ma$. A larger net force gives more acceleration; a larger mass gives less acceleration for the same force. For a 4 kg cart with a 20 N net force, $a=20/4=5 m/s^2$."
    },
    {
      "id": "signs",
      "title": "3. Choose a positive direction",
      "markdown": "Choose one direction as positive before calculating. If right is positive, a 7 N force left is $-7$ N. The sign records direction; it does not mean the force has a negative size."
    }
  ],
  "checkpoint": {
    "title": "Checkpoint",
    "instructions": "Use right as positive. Enter numbers only; include a minus sign for a leftward result.",
    "questions": [
      {"id": "q1", "prompt": "A box has 6 N right and 6 N left. What is the net force in newtons?", "feedback": "Equal opposite forces cancel."},
      {"id": "q2", "prompt": "A cart has 9 N right and 5 N left. What is the net force?", "feedback": "Subtract the opposing force from the larger force."},
      {"id": "q3", "prompt": "A 4 kg cart has a 20 N net force. What is its acceleration?", "feedback": "Use a = F/m."},
      {"id": "q4", "prompt": "What net force accelerates a 3 kg object at 4 m/s²?", "feedback": "Use F = ma."},
      {"id": "q5", "prompt": "Right is positive. What signed net force results from 2 N right and 5 N left?", "feedback": "The larger force points left, so the answer is negative."}
    ]
  },
  "citations": [
    {"title": "OpenStax Physics — Force and Mass", "url": "https://openstax.org/books/physics/pages/4-2-newtons-first-law-of-motion-inertia", "note": "Background on forces and changes in motion."},
    {"title": "OpenStax Physics — Newton's Second Law", "url": "https://openstax.org/books/physics/pages/4-3-newtons-second-law-of-motion", "note": "Reference for net force, mass, and acceleration."}
  ]
}
